{
  "harness_sha256": "ef57926174b22c2c22e73843a08a5ea9b7b45481bf51ef08dac21129ea9c929a",
  "hosted_calls": 0,
  "manifest_sha256": "d0508dd3586723f8d8ff81ee6ae8a2f4aca381905c45b3ceac42b2770cabc266",
  "profile": "ci",
  "protocol": "stream-v2",
  "representative_provider": {
    "cost_usd_per_request": 0.00025,
    "mode": "deterministic_simulation",
    "network_access": false,
    "quota_requests_per_minute": 60
  },
  "runs": [
    {
      "case_id": "small-sqlite",
      "concurrency": 1,
      "cpu_seconds": 0.027186,
      "events": 25,
      "events_per_second": 62.823,
      "fixture_kind": "sqlite",
      "fixture_sha256": "d3a7ad1f5e08f5d2d3bd31ccccb957b66f36533c6ce9c1d6fbd7d869848ce235",
      "input_bytes": 16384,
      "integrity": {
        "complete": true,
        "duplicate_acks": 1,
        "duplicate_side_effects": 0,
        "expected_windows": 8,
        "idempotency_replay_kind": "session_end",
        "idempotency_replays": 1,
        "idempotency_state_components": [
          "duplicate_acks",
          "encoded_bytes",
          "max_queue_depth",
          "projected_digest",
          "projected_rows",
          "queue_items",
          "received_digest",
          "received_rows",
          "redacted_events",
          "redaction_failures",
          "requests",
          "work_queue_items"
        ],
        "projected_windows": 8,
        "redacted_events": 16,
        "redaction_failures": 0
      },
      "lifecycle_seconds": {
        "first_usable": 0.120124,
        "fully_ready": 0.399896,
        "transferred": 0.397943
      },
      "mib_per_second": 0.039,
      "peak_rss_bytes": 33718272,
      "phase_seconds": {
        "discovery": 0.004802,
        "entity_resolution": 3.1e-05,
        "network_wait": 0.131823,
        "normalization_redaction": 0.004659,
        "projection_indexing": 0.060824,
        "provider_extraction": 0.040517,
        "queue_delay": 0.000588,
        "request_encoding": 0.000249,
        "server_persistence": 0.102529,
        "source_reading": 0.002089,
        "summary_reduction": 6e-06
      },
      "provider": {
        "max_in_flight": 1,
        "modeled_cost_usd": 0.002,
        "modeled_quota_seconds": 8.0,
        "observed_time_seconds": 0.040517,
        "quota_requests_per_minute": 60,
        "requests": 8,
        "retries": 0,
        "worker_threads_used": 1
      },
      "quality": {
        "projection_failures": 0,
        "terminal_failures": 0
      },
      "queue": {
        "max_age_seconds": 0.000164,
        "max_depth": 1
      },
      "requests": 25,
      "retries": 0,
      "source_file_bytes": 45056,
      "terminal_failures": 0,
      "traces": [
        {
          "phase": "discovery",
          "seconds": 0.004802
        },
        {
          "phase": "source_reading",
          "seconds": 0.002089
        },
        {
          "phase": "normalization_redaction",
          "seconds": 0.004659
        },
        {
          "phase": "request_encoding",
          "seconds": 0.000249
        },
        {
          "phase": "network_wait",
          "seconds": 0.131823
        },
        {
          "phase": "server_persistence",
          "seconds": 0.102529
        },
        {
          "phase": "queue_delay",
          "seconds": 0.000588
        },
        {
          "phase": "provider_extraction",
          "seconds": 0.040517
        },
        {
          "phase": "entity_resolution",
          "seconds": 3.1e-05
        },
        {
          "phase": "projection_indexing",
          "seconds": 0.060824
        },
        {
          "phase": "summary_reduction",
          "seconds": 6e-06
        }
      ],
      "wall_time_seconds": 0.399896,
      "windows": 8,
      "windows_per_minute": 1200.312
    },
    {
      "case_id": "small-sqlite",
      "concurrency": 2,
      "cpu_seconds": 0.026553,
      "events": 25,
      "events_per_second": 73.242,
      "fixture_kind": "sqlite",
      "fixture_sha256": "d3a7ad1f5e08f5d2d3bd31ccccb957b66f36533c6ce9c1d6fbd7d869848ce235",
      "input_bytes": 16384,
      "integrity": {
        "complete": true,
        "duplicate_acks": 1,
        "duplicate_side_effects": 0,
        "expected_windows": 8,
        "idempotency_replay_kind": "session_end",
        "idempotency_replays": 1,
        "idempotency_state_components": [
          "duplicate_acks",
          "encoded_bytes",
          "max_queue_depth",
          "projected_digest",
          "projected_rows",
          "queue_items",
          "received_digest",
          "received_rows",
          "redacted_events",
          "redaction_failures",
          "requests",
          "work_queue_items"
        ],
        "projected_windows": 8,
        "redacted_events": 16,
        "redaction_failures": 0
      },
      "lifecycle_seconds": {
        "first_usable": 0.121783,
        "fully_ready": 0.344191,
        "transferred": 0.341334
      },
      "mib_per_second": 0.046,
      "peak_rss_bytes": 33619968,
      "phase_seconds": {
        "discovery": 0.004819,
        "entity_resolution": 3.2e-05,
        "network_wait": 0.131736,
        "normalization_redaction": 0.005367,
        "projection_indexing": 0.03197,
        "provider_extraction": 0.040528,
        "queue_delay": 0.04194,
        "request_encoding": 0.000251,
        "server_persistence": 0.07435,
        "source_reading": 0.002122,
        "summary_reduction": 5e-06
      },
      "provider": {
        "max_in_flight": 2,
        "modeled_cost_usd": 0.002,
        "modeled_quota_seconds": 8.0,
        "observed_time_seconds": 0.040528,
        "quota_requests_per_minute": 60,
        "requests": 8,
        "retries": 0,
        "worker_threads_used": 2
      },
      "quality": {
        "projection_failures": 0,
        "terminal_failures": 0
      },
      "queue": {
        "max_age_seconds": 0.04144,
        "max_depth": 1
      },
      "requests": 25,
      "retries": 0,
      "source_file_bytes": 45056,
      "terminal_failures": 0,
      "traces": [
        {
          "phase": "discovery",
          "seconds": 0.004819
        },
        {
          "phase": "source_reading",
          "seconds": 0.002122
        },
        {
          "phase": "normalization_redaction",
          "seconds": 0.005367
        },
        {
          "phase": "request_encoding",
          "seconds": 0.000251
        },
        {
          "phase": "network_wait",
          "seconds": 0.131736
        },
        {
          "phase": "server_persistence",
          "seconds": 0.07435
        },
        {
          "phase": "queue_delay",
          "seconds": 0.04194
        },
        {
          "phase": "provider_extraction",
          "seconds": 0.040528
        },
        {
          "phase": "entity_resolution",
          "seconds": 3.2e-05
        },
        {
          "phase": "projection_indexing",
          "seconds": 0.03197
        },
        {
          "phase": "summary_reduction",
          "seconds": 5e-06
        }
      ],
      "wall_time_seconds": 0.344191,
      "windows": 8,
      "windows_per_minute": 1394.573
    },
    {
      "case_id": "small-sqlite",
      "concurrency": 3,
      "cpu_seconds": 0.025833,
      "events": 25,
      "events_per_second": 74.101,
      "fixture_kind": "sqlite",
      "fixture_sha256": "d3a7ad1f5e08f5d2d3bd31ccccb957b66f36533c6ce9c1d6fbd7d869848ce235",
      "input_bytes": 16384,
      "integrity": {
        "complete": true,
        "duplicate_acks": 1,
        "duplicate_side_effects": 0,
        "expected_windows": 8,
        "idempotency_replay_kind": "session_end",
        "idempotency_replays": 1,
        "idempotency_state_components": [
          "duplicate_acks",
          "encoded_bytes",
          "max_queue_depth",
          "projected_digest",
          "projected_rows",
          "queue_items",
          "received_digest",
          "received_rows",
          "redacted_events",
          "redaction_failures",
          "requests",
          "work_queue_items"
        ],
        "projected_windows": 8,
        "redacted_events": 16,
        "redaction_failures": 0
      },
      "lifecycle_seconds": {
        "first_usable": 0.162266,
        "fully_ready": 0.341269,
        "transferred": 0.337376
      },
      "mib_per_second": 0.046,
      "peak_rss_bytes": 33607680,
      "phase_seconds": {
        "discovery": 0.004911,
        "entity_resolution": 3.1e-05,
        "network_wait": 0.131708,
        "normalization_redaction": 0.005311,
        "projection_indexing": 0.059119,
        "provider_extraction": 0.040538,
        "queue_delay": 0.114514,
        "request_encoding": 0.000272,
        "server_persistence": 0.074881,
        "source_reading": 0.002207,
        "summary_reduction": 4e-06
      },
      "provider": {
        "max_in_flight": 3,
        "modeled_cost_usd": 0.002,
        "modeled_quota_seconds": 8.0,
        "observed_time_seconds": 0.040538,
        "quota_requests_per_minute": 60,
        "requests": 8,
        "retries": 0,
        "worker_threads_used": 3
      },
      "quality": {
        "projection_failures": 0,
        "terminal_failures": 0
      },
      "queue": {
        "max_age_seconds": 0.076707,
        "max_depth": 1
      },
      "requests": 25,
      "retries": 0,
      "source_file_bytes": 45056,
      "terminal_failures": 0,
      "traces": [
        {
          "phase": "discovery",
          "seconds": 0.004911
        },
        {
          "phase": "source_reading",
          "seconds": 0.002207
        },
        {
          "phase": "normalization_redaction",
          "seconds": 0.005311
        },
        {
          "phase": "request_encoding",
          "seconds": 0.000272
        },
        {
          "phase": "network_wait",
          "seconds": 0.131708
        },
        {
          "phase": "server_persistence",
          "seconds": 0.074881
        },
        {
          "phase": "queue_delay",